Title,Authors,Abstract,Published Year,Published Month,Journal,Volume,Issue,Pages,Accession Number,DOI,Ref,Covidence #,Study,Notes,Tags
Functional Studies of Genetic Variants Associated with Human Diseases in Notch Signaling-Related Genes Using Drosophila.,Yang SA.; Salazar JL.; Li-Kroeger D.; Yamamoto S.,"Rare variants in the many genes related to Notch signaling cause diverse Mendelian diseases that affect myriad organ systems. In addition, genome- and exome-wide association studies have linked common and rare variants in Notch-related genes to common diseases and phenotypic traits. Moreover, somatic mutations in these genes have been observed in many types of cancer, some of which are classified as oncogenic and others as tumor suppressive. While functional characterization of some of these variants has been performed through experimental studies, the number of ""variants of unknown significance"" identified in patients with diverse conditions keeps increasing as high-throughput sequencing technologies become more commonly used in the clinic. Furthermore, as disease gene discovery efforts identify rare variants in human genes that have yet to be linked to a disease, the demand for functional characterization of variants in these ""genes of unknown significance"" continues to increase. In this chapter, we describe a workflow to functionally characterize a rare variant in a Notch signaling related gene that was found to be associated with late-onset Alzheimer's disease. This pipeline involves informatic analysis of the variant of interest using diverse human and model organism databases, followed by in vivo experiments in the fruit fly Drosophila melanogaster. The protocol described here can be used to study variants that affect amino acids that are not conserved between human and fly. By ""humanizing"" the almondex gene in Drosophila with mutant alleles and heterologous genomic rescue constructs, a missense variant in TM2D3 (TM2 Domain Containing 3) was shown to be functionally damaging. This, and similar approaches, greatly facilitate functional interpretations of genetic variants in the human genome and propel personalized medicine.",2022,,"Methods in molecular biology (Clifton, N.J.)",2472,,235-276,,10.1007/978-1-0716-2201-8_19,35674905,#1606,Yang 2022,"",""
Genome-wide screen to identify genetic loci associated with cognitive decline in late-life depression.,Steffens DC.; Garrett ME.; Soldano KL.; McQuoid DR.; Ashley-Koch AE.; Potter GG.,"This study sought to conduct a comprehensive search for genetic risk of cognitive decline in the context of geriatric depression. A genome-wide association study (GWAS) analysis in the Neurocognitive Outcomes of Depression in the Elderly (NCODE) study. Longitudinal, naturalistic follow-up study. Older depressed adults, both outpatients and inpatients, receiving care at an academic medical center. The Consortium to Establish a Registry for Alzheimer's Disease (CERAD) neuropsychological battery was administered to the study participants at baseline and a minimum of twice within a subsequent 3-year period in order to measure cognitive decline. A GWAS analysis was conducted to identify genetic variation that is associated with baseline and change in the CERAD Total Score (CERAD-TS) in NCODE. The GWAS of baseline CERAD-TS revealed a significant association with an intergenic single-nucleotide polymorphism (SNP) on chromosome 6, rs17662598, that surpassed adjustment for multiple testing (p = 3.7 × 10-7; false discovery rate q = 0.0371). For each additional G allele, average baseline CERAD-TS decreased by 8.656 points. The most significant SNP that lies within a gene was rs11666579 in SLC27A1 (p = 1.1 × 10-5). Each additional copy of the G allele was associated with an average decrease of baseline CERAD-TS of 4.829 points. SLC27A1 is involved with processing docosahexaenoic acid (DHA), an endogenous neuroprotective compound in the brain. Decreased levels of DHA have been associated with the development of Alzheimer's disease. The most significant SNP associated with CERAD-TS decline over time was rs73240021 in GRXCR1 (p = 1.1 × 10-6), a gene previously linked with deafness. However, none of the associations within genes survived adjustment for multiple testing. Our GWAS of cognitive function and decline among individuals with late-life depression (LLD) has identified promising candidate genes that, upon replication in other cohorts of LLD, may be potential biomarkers for cognitive decline and suggests DHA supplementation as a possible therapy of interest.",2020,Jul,International psychogeriatrics,,,1-9,,10.1017/S1041610220001143,32641180,#1576,Steffens 2020,"",""
Novel Alzheimer's disease risk variants identified based on whole-genome sequencing of APOE ε4 carriers.,Park JH.; Park I.; Youm EM.; Lee S.; Park JH.; Lee J.; Lee DY.; Byun MS.; Lee JH.; Yi D.; Chung SJ.; Park KW.; Choi N.; Kim SY.; Yoon W.; An H.; Kim KW.; Choi SH.; Jeong JH.; Kim EJ.; Kang H.; Lee J.; Kim Y.; Lee EA.; Seo SW.; Na DL.; Kim JW.,"Alzheimer's disease (AD) is a progressive neurodegenerative disease associated with a complex genetic etiology. Besides the apolipoprotein E ε4 (APOE ε4) allele, a few dozen other genetic loci associated with AD have been identified through genome-wide association studies (GWAS) conducted mainly in individuals of European ancestry. Recently, several GWAS performed in other ethnic groups have shown the importance of replicating studies that identify previously established risk loci and searching for novel risk loci. APOE-stratified GWAS have yielded novel AD risk loci that might be masked by, or be dependent on, APOE alleles. We performed whole-genome sequencing (WGS) on DNA from blood samples of 331 AD patients and 169 elderly controls of Korean ethnicity who were APOE ε4 carriers. Based on WGS data, we designed a customized AD chip (cAD chip) for further analysis on an independent set of 543 AD patients and 894 elderly controls of the same ethnicity, regardless of their APOE ε4 allele status. Combined analysis of WGS and cAD chip data revealed that SNPs rs1890078 (P = 6.64E-07) and rs12594991 (P = 2.03E-07) in SORCS1 and CHD2 genes, respectively, are novel genetic variants among APOE ε4 carriers in the Korean population. In addition, nine possible novel variants that were rare in individuals of European ancestry but common in East Asia were identified. This study demonstrates that APOE-stratified analysis is important for understanding the genetic background of AD in different populations.",2021,05,Translational psychiatry,11,1,296,,10.1038/s41398-021-01412-9,34011927,#1569,Park 2021,"",""
Use of Deep-Learning Genomics to Discriminate Healthy Individuals from Those with Alzheimer's Disease or Mild Cognitive Impairment.,Li L.; Yang Y.; Zhang Q.; Wang J.; Jiang J.; Neuroimaging Initiative AD.,"Alzheimer's disease (AD) is the most prevalent neurodegenerative disorder and the most common form of dementia in the elderly. Certain genes have been identified as important clinical risk factors for AD, and technological advances in genomic research, such as genome-wide association studies (GWAS), allow for analysis of polymorphisms and have been widely applied to studies of AD. However, shortcomings of GWAS include sensitivity to sample size and hereditary deletions, which result in low classification and predictive accuracy. Therefore, this paper proposes a novel deep-learning genomics approach and applies it to multitasking classification of AD progression, with the goal of identifying novel genetic biomarkers overlooked by traditional GWAS analysis. In this study, we selected genotype data from 1461 subjects enrolled in the Alzheimer's Disease Neuroimaging Initiative, including 622 AD, 473 mild cognitive impairment (MCI), and 366 healthy control (HC) subjects. The proposed deep-learning genomics (DLG) approach consists of three steps: quality control, coding of single-nucleotide polymorphisms, and classification. The ResNet framework was used for the DLG model, and the results were compared with classifications by simple convolutional neural network structure. All data were randomly assigned to one training/validation group and one test group at a ratio of 9 : 1. And fivefold cross-validation was used. We compared classification results from the DLG model to those from traditional GWAS analysis among the three groups. For the AD and HC groups, the accuracy, sensitivity, and specificity of classification were, respectively, 98.78 ± 1.50%, 98.39% ± 2.50%, and 99.44% ± 1.11% using the DLG model, while 71.38% ± 0.63%, 63.13% ± 2.87%, and 85.59% ± 6.66% using traditional GWAS. Similar results were obtained from the other two intergroup classifications. The DLG model can achieve higher accuracy and sensitivity when applied to progression of AD. More importantly, we discovered several novel genetic biomarkers of AD progression, including rs6311 and rs6313 in HTR2A, rs1354269 in NAV2, and rs690705 in RFC3. The roles of these novel loci in AD should be explored in future research.",2021,,Behavioural neurology,2021,,3359103,,10.1155/2021/3359103,34336000,#1565,Li 2021,"",""
Linkage of Alzheimer disease families with Puerto Rican ancestry identifies a chromosome 9 locus.,Rajabli F.; Feliciano-Astacio BE.; Cukier HN.; Wang L.; Griswold AJ.; Hamilton-Nelson KL.; Adams LD.; Rodriguez VC.; Mena PR.; Tejada S.; Celis K.; Whitehead PL.; Van Booven DJ.; Hofmann NK.; Bussies PL.; Prough M.; Chinea A.; Feliciano NI.; Vardarajan BN.; Reitz C.; Lee JH.; Prince MJ.; Jimenez IZ.; Mayeux RP.; Acosta H.; Dalgard CL.; Haines JL.; Vance JM.; Cuccaro ML.; Beecham GW.; Pericak-Vance MA.,"The genetic admixture of Caribbean Hispanics provides an opportunity to discover novel genetic factors in Alzheimer disease (AD). We sought to identify genetic variants for AD through a family-based design using the Puerto Rican (PR) Alzheimer Disease Initiative (PRADI). Whole-genome sequencing (WGS) and parametric linkage analysis were performed for 100 individuals from 23 multiplex PRADI families. Variants were prioritized by minor allele frequency (<0.01), functional potential [combined annotation dependent depletion score (CADD) >10], and co-segregation with AD. Variants were further ranked using an independent PR case-control WGS dataset (PR10/66). A genome-wide significant linkage peak was found in 9p21 with a heterogeneity logarithm of the odds score (HLOD) >5.1, which overlaps with an AD linkage region from two published independent studies. The region harbors C9orf72, but no expanded repeats were observed in the families. Seven variants prioritized by the PRADI families also displayed evidence for association in the PR10/66 (p < 0.05), including a missense variant in UNC13B. Our study demonstrated the importance of family-based design and WGS in genetic study of AD.",2021,08,Neurobiology of aging,104,,115.e1-115.e7,,10.1016/j.neurobiolaging.2021.02.019,33902942,#1622,Rajabli 2021,"",""
An L0 Regularization Method for Imaging Genetics and Whole Genome Association Analysis on Alzheimer's Disease.,Li X.; Lin Y.; Meng X.; Qiu Y.; Hu B.,"Although the neuroimaging measures build a bridge between genetic variants and disease phenotypes, an assessment of single nucleotide variants changes in brain structure and their clinically influence on the progression of Alzheimer's disease remain largely preliminary. Note that each variant has very weak correlation signal to neuroimaging measures or Alzheimer's disease phenotypes. Therefore, traditional sparse regression-based image genetics approaches confront with unresolvable features, relative high regression error or inapplicability of high-dimensional data. Adopting an [Formula: see text] regularization method, we significantly elevate the regression accuracy of imaging genetics compared with group-sparse multitask regression method. With further analysis on the simulation results, we conclude that multiple regression tasks model may be unsuitable for image genetics. In addition, we carried out a whole genome association analysis between genetic variants (about 388 million loci) and phenotypes (cognition normal, mild cognitive impairment and Alzheimer's disease) with using the [Formula: see text] regularization method. After annotating the effect of all variants by Ensembl Variant Effect Predictor (VEP), our method locates 33 missense variants which can explain 40% phenotype variance. Then, we mapped each missense variant to the nearest gene and carried out pathway enrichment analysis. The Notch signaling pathway and Apoptosis pathway have been reported to be related to the formation of Alzheimer's disease.",2021,09,IEEE journal of biomedical and health informatics,25,9,3677-3684,,10.1109/JBHI.2021.3093027,34181562,#1619,Li 2021,"",""
Meta-analysis of genome-wide association studies identifies ancestry-specific associations underlying circulating total tau levels.,Sarnowski C.; Ghanbari M.; Bis JC.; Logue M.; Fornage M.; Mishra A.; Ahmad S.; Beiser AS.; Boerwinkle E.; Bouteloup V.; Chouraki V.; Cupples LA.; Damotte V.; DeCarli CS.; DeStefano AL.; Djoussé L.; Fohner AE.; Franz CE.; Kautz TF.; Lambert JC.; Lyons MJ.; Mosley TH.; Mukamal KJ.; Pase MP.; Portilla Fernandez EC.; Rissman RA.; Satizabal CL.; Vasan RS.; Yaqub A.; Debette S.; Dufouil C.; Launer LJ.; Kremen WS.; Longstreth WT.; Ikram MA.; Seshadri S.,"Circulating total-tau levels can be used as an endophenotype to identify genetic risk factors for tauopathies and related neurological disorders. Here, we confirmed and better characterized the association of the 17q21 MAPT locus with circulating total-tau in 14,721 European participants and identified three novel loci in 953 African American participants (4q31, 5p13, and 6q25) at P < 5 × 10-8. We additionally detected 14 novel loci at P < 5 × 10-7, specific to either Europeans or African Americans. Using whole-exome sequence data in 2,279 European participants, we identified ten genes associated with circulating total-tau when aggregating rare variants. Our genetic study sheds light on genes reported to be associated with neurological diseases including stroke, Alzheimer's, and Parkinson's (F5, MAP1B, and BCAS3), with Alzheimer's pathological hallmarks (ADAMTS12, IL15, and FHIT), or with an important function in the brain (PARD3, ELFN2, UBASH3B, SLIT3, and NSD3), and suggests that the genetic architecture of circulating total-tau may differ according to ancestry.",2022,04,Communications biology,5,1,336,,10.1038/s42003-022-03287-y,35396452,#1610,Sarnowski 2022,"",""
Pleiotropic predisposition to Alzheimer's disease and educational attainment: insights from the summary statistics analysis.,Kulminski AM.; Loiko E.; Loika Y.; Culminskaya I.,"Epidemiological studies report beneficial associations of higher educational attainment (EDU) with Alzheimer's disease (AD). Prior genome-wide association studies (GWAS) also reported variants associated with AD and EDU separately. The analysis of pleiotropic associations with these phenotypes may shed light on EDU-related protection against AD. We performed pleiotropic meta-analyses using Fisher's method and omnibus test applied to summary statistics for single nucleotide polymorphisms (SNPs) associated with AD and EDU in large-scale univariate GWAS at suggestive-effect (5 × 10-8 < p < 0.1) and genome-wide (p ≤ 5 × 10-8) significance levels. We report 53 SNPs that attained p ≤ 5 × 10-8 at least in one of the pleiotropic meta-analyses and were reported in the univariate GWAS at 5 × 10-8 < p < 0.1. Of them, there were 46 pleiotropic SNPs according to Fisher's method. Additionally, Fisher's method identified 25 of 206 SNPs with pleiotropic effects, which attained p ≤ 5 × 10-8 in the univariate GWAS. We showed that a large fraction of the pleiotropic associations was affected by a counterintuitive phenomenon of antagonistic genetic heterogeneity, which explains the increase, rather than decrease, of the significance of the pleiotropic associations in the omnibus test. Functional enrichment analysis showed that apart from cancers, gene set harboring the non-pleiotropic SNPs was characterized by late-onset AD and neurodevelopmental disorders. The pleiotropic gene set was characterized by a broad spectrum of progressive neurological and neuromuscular diseases and immune-mediated conditions, including progressive motor neuropathy, multiple sclerosis, Parkinson's disease, and severe AD. Our results suggest that disentangling genes harboring variants with and without pleiotropic associations with AD and EDU is promising for dissecting heterogeneity in biological mechanisms of AD.",2022,02,GeroScience,44,1,265-280,,10.1007/s11357-021-00484-1,34743297,#1563,Kulminski 2022,"",""
Shared genetic etiology underlying late-onset Alzheimer's disease and posttraumatic stress syndrome.,Lutz MW.; Luo S.; Williamson DE.; Chiba-Falek O.,"Late-onset Alzheimer's disease (LOAD) manifests comorbid neuropsychiatric symptoms and posttraumatic stress disorder (PTSD) is associated with an increased risk for dementia in late life, suggesting the two disorders may share genetic etiologies. We performed genetic pleiotropy analysis using LOAD and PTSD genome-wide association study (GWAS) datasets from white and African-American populations, followed by functional-genomic analyses. We found an enrichment for LOAD across increasingly stringent levels of significance with the PTSD GWAS association (LOAD|PTSD) in the discovery and replication cohorts and a modest enrichment for the reverse conditional association (PTSD|LOAD). LOAD|PTSD association analysis identified and replicated the MS4A genes region. These genes showed similar expression pattern in brain regions affected in LOAD, and across-brain-tissue analysis identified a significant association for MS4A6A. The African-American samples showed moderate enrichment; however, no false discovery rate-significant associations. We demonstrated common genetic signatures for LOAD and PTSD and suggested immune response as a common pathway for these diseases.",2020,09,Alzheimer's & dementia : the journal of the Alzheimer's Association,16,9,1280-1292,,10.1002/alz.12128,32588970,#1578,Lutz 2020,"",""
Rare variant testing of imputed data: an analysis pipeline typified.,Drichel D.; Herold C.; Lacour A.; Ramirez A.; Jessen F.; Maier W.; Noethen MM.; Leber M.; Vaitsiakhovich T.; Becker T.,"Important methodological advancements in rare variant association testing have been made recently, among them collapsing tests, kernel methods and the variable threshold (VT) technique. Typically, rare variants from a region of interest are tested for association as a group ('bin'). Rare variant studies are already routinely performed as whole-exome sequencing studies. As an alternative approach, we propose a pipeline for rare variant analysis of imputed data and develop respective quality control criteria. We provide suggestions for the choice and construction of analysis bins in whole-genome application and support the analysis with implementations of standard burden tests (COLL, CMAT) in our INTERSNP-RARE software. In addition, three rare variant regression tests (REG, FRACREG and COLLREG) are implemented. All tests are accompanied with the VT approach which optimizes the definition of 'rareness'. We integrate kernel tests as implemented in SKAT/SKAT-O into the suggested strategies. Then, we apply our analysis scheme to a genome-wide association study of Alzheimer's disease. Further, we show that our pipeline leads to valid significance testing procedures with controlled type I error rates. Strong association signals surrounding the known APOE locus demonstrate statistical power. In addition, we highlight several suggestive rare variant association findings for follow-up studies, including genomic regions overlapping MCPH1, MED18 and NOTCH3. In summary, we describe and support a straightforward and cost-efficient rare variant analysis pipeline for imputed data and demonstrate its feasibility and validity. The strategy can complement rare variant studies with next generation sequencing data.",2014,,Human heredity,78,3-4,164-78,,10.1159/000368676,25504234,#1492,Drichel 2014,"",""
Identification of genetic heterogeneity of Alzheimer's disease across age.,Lo MT.; Kauppi K.; Fan CC.; Sanyal N.; Reas ET.; Sundar VS.; Lee WC.; Desikan RS.; McEvoy LK.; Chen CH.;  .,"The risk of APOE for Alzheimer's disease (AD) is modified by age. Beyond APOE, the polygenic architecture may also be heterogeneous across age. We aim to investigate age-related genetic heterogeneity of AD and identify genomic loci with differential effects across age. Stratified gene-based genome-wide association studies and polygenic variation analyses were performed in the younger (60-79 years, N = 14,895) and older (≥80 years, N = 6559) age-at-onset groups using Alzheimer's Disease Genetics Consortium data. We showed a moderate genetic correlation (rg = 0.64) between the two age groups, supporting genetic heterogeneity. Heritability explained by variants on chromosome 19 (harboring APOE) was significantly larger in younger than in older onset group (p < 0.05). APOE region, BIN1, OR2S2, MS4A4E, and PICALM were identified at the gene-based genome-wide significance (p < 2.73 × 10-6) with larger effects at younger age (except MS4A4E). For the novel gene OR2S2, we further performed leave-one-out analyses, which showed consistent effects across subsamples. Our results suggest using genetically more homogeneous individuals may help detect additional susceptible loci.",2019,12,Neurobiology of aging,84,,243.e1-243.e9,,10.1016/j.neurobiolaging.2019.02.022,30979435,#1457,Lo 2019,"",""
Identification of Alzheimer risk factors through whole-genome analysis.,Hardy J.; Williams J.,,2010,Jun,Archives of neurology,67,6,663-4,,10.1001/archneurol.2010.97,20558384,#1476,Hardy 2010,"",""
A Bayesian Framework for Generalized Linear Mixed Modeling Identifies New Candidate Loci for Late-Onset Alzheimer's Disease.,Wang X.; Philip VM.; Ananda G.; White CC.; Malhotra A.; Michalski PJ.; Karuturi KRM.; Chintalapudi SR.; Acklin C.; Sasner M.; Bennett DA.; De Jager PL.; Howell GR.; Carter GW.,"Recent technical and methodological advances have greatly enhanced genome-wide association studies (GWAS). The advent of low-cost, whole-genome sequencing facilitates high-resolution variant identification, and the development of linear mixed models (LMM) allows improved identification of putatively causal variants. While essential for correcting false positive associations due to sample relatedness and population stratification, LMMs have commonly been restricted to quantitative variables. However, phenotypic traits in association studies are often categorical, coded as binary case-control or ordered variables describing disease stages. To address these issues, we have devised a method for genomic association studies that implements a generalized LMM (GLMM) in a Bayesian framework, called Bayes-GLMM Bayes-GLMM has four major features: (1) support of categorical, binary, and quantitative variables; (2) cohesive integration of previous GWAS results for related traits; (3) correction for sample relatedness by mixed modeling; and (4) model estimation by both Markov chain Monte Carlo sampling and maximal likelihood estimation. We applied Bayes-GLMM to the whole-genome sequencing cohort of the Alzheimer's Disease Sequencing Project. This study contains 570 individuals from 111 families, each with Alzheimer's disease diagnosed at one of four confidence levels. Using Bayes-GLMM we identified four variants in three loci significantly associated with Alzheimer's disease. Two variants, rs140233081 and rs149372995, lie between PRKAR1B and PDGFA The coded proteins are localized to the glial-vascular unit, and PDGFA transcript levels are associated with Alzheimer's disease-related neuropathology. In summary, this work provides implementation of a flexible, generalized mixed-model approach in a Bayesian framework for association studies.",2018,05,Genetics,209,1,51-64,,10.1534/genetics.117.300673,29507048,#1527,Wang 2018,"",""
