Title,Authors,Abstract,Published Year,Published Month,Journal,Volume,Issue,Pages,Accession Number,DOI,Ref,Covidence #,Study,Notes,Tags
"High-depth whole genome sequencing of an Ashkenazi Jewish reference panel: enhancing sensitivity, accuracy, and imputation.",Lencz T.; Yu J.; Palmer C.; Carmi S.; Ben-Avraham D.; Barzilai N.; Bressman S.; Darvasi A.; Cho JH.; Clark LN.; Gümüş ZH.; Joseph V.; Klein R.; Lipkin S.; Offit K.; Ostrer H.; Ozelius LJ.; Peter I.; Atzmon G.; Pe'er I.,"While increasingly large reference panels for genome-wide imputation have been recently made available, the degree to which imputation accuracy can be enhanced by population-specific reference panels remains an open question. Here, we sequenced at full-depth (≥ 30×), across two platforms (Illumina X Ten and Complete Genomics, Inc.), a moderately large (n = 738) cohort of samples drawn from the Ashkenazi Jewish population. We developed a series of quality control steps to optimize sensitivity, specificity, and comprehensiveness of variant calls in the reference panel, and then tested the accuracy of imputation against target cohorts drawn from the same population. Quality control (QC) thresholds for the Illumina X Ten platform were identified that permitted highly accurate calling of single nucleotide variants across 94% of the genome. QC procedures also identified numerous regions that are poorly mapped using current reference or alternate assemblies. After stringent QC, the population-specific reference panel produced more accurate and comprehensive imputation results relative to publicly available, large cosmopolitan reference panels, especially in the range of rare variants that may be most critical to further progress in mapping of complex phenotypes. The population-specific reference panel also permitted enhanced filtering of clinically irrelevant variants from personal genomes.",2018,Apr,Human genetics,137,4,343-355,,10.1007/s00439-018-1886-z,29705978,#1531,Lencz 2018,"",""
Linkage to the 8p21.1 region Including the CLU gene in age at onset stratified alzheimer's disease families.,Sillén A.; Lilius L.; Forsell C.; Kimura T.; Winblad B.; Graff C.,"Two powerful genome-wide association studies have recently reported significant association between sporadic late-onset Alzheimer's disease (AD) and markers at the CLU locus in chromosome 8p. In this study, we have stratified our previously analyzed 109 Swedish AD families according to range in age at onset and performed whole-genome linkage analysis and subsequent fine-mapping in 8p21. The subgroup analyzed in the fine-mapping consisted of 28 families with AD, having a within-family onset-range not exceeding 8 years and an age at onset between 49 ≤ 70 years. A maximum non-parametric linkage peak (LOD = 3.5) was found between markers D8S1809 and 236c6-1. Intriguingly this linked 9.5cM region contains clusterin (CLU), which is one of the two top susceptibility genes for AD. Our finding may be a reflection of linkage to the CLU susceptibility gene, in the same way as familial AD has previously been linked to the APOE locus.",2011,,Journal of Alzheimer's disease : JAD,23,1,13-20,,10.3233/JAD-2010-101359,20930273,#1477,Sillén 2011,"",""
Rare Variants Imputation in Admixed Populations: Comparison Across Reference Panels and Bioinformatics Tools.,Sariya S.; Lee JH.; Mayeux R.; Vardarajan BN.; Reyes-Dumeyer D.; Manly JJ.; Brickman AM.; Lantigua R.; Medrano M.; Jimenez-Velazquez IZ.; Tosto G.,"Imputation has become a standard approach in genome-wide association studies (GWAS) to infer in silico untyped markers. Although feasibility for common variants imputation is well established, we aimed to assess rare and ultra-rare variants' imputation in an admixed Caribbean Hispanic population (CH). We evaluated imputation accuracy in CH (N = 1,000), focusing on rare (0.1% ≤ minor allele frequency (MAF) ≤ 1%) and ultra-rare (MAF < 0.1%) variants. We used two reference panels, the Haplotype Reference Consortium (HRC; N = 27,165) and 1000 Genome Project (1000G phase 3; N = 2,504) and multiple phasing (SHAPEIT, Eagle2) and imputation algorithms (IMPUTE2, MACH-Admix). To assess imputation quality, we reported: (a) high-quality variant counts according to imputation tools' internal indexes (e.g., IMPUTE2 ""Info"" ≥ 80%). (b) Wilcoxon Signed-Rank Test comparing imputation quality for genotyped variants that were masked and imputed; (c) Cohen's kappa coefficient to test agreement between imputed and whole-exome sequencing (WES) variants; (d) imputation of G206A mutation in the PSEN1 (ultra-rare in the general population an more frequent in CH) followed by confirmation genotyping. We also tested ancestry proportion (European, African and Native American) against WES-imputation mismatches in a Poisson regression fashion. SHAPEIT2 retrieved higher percentage of imputed high-quality variants than Eagle2 (rare: 51.02% vs. 48.60%; ultra-rare 0.66% vs. 0.65%, Wilcoxon p-value < 0.001). SHAPEIT-IMPUTE2 employing HRC outperformed 1000G (64.50% vs. 59.17%; 1.69% vs. 0.75% for high-quality rare and ultra-rare variants, respectively, Wilcoxon p-value < 0.001). SHAPEIT-IMPUTE2 outperformed MaCH-Admix. Compared to 1000G, HRC-imputation retrieved a higher number of high-quality rare and ultra-rare variants, despite showing lower agreement between imputed and WES variants (e.g., rare: 98.86% for HRC vs. 99.02% for 1000G). High Kappa (K = 0.99) was observed for both reference panels. Twelve G206A mutation carriers were imputed and all validated by confirmation genotyping. African ancestry was associated with higher imputation errors for uncommon and rare variants (p-value < 1e-05). Reference panels with larger numbers of haplotypes can improve imputation quality for rare and ultra-rare variants in admixed populations such as CH. Ethnic composition is an important predictor of imputation accuracy, with higher African ancestry associated with poorer imputation accuracy.",2019,,Frontiers in genetics,10,,239,,10.3389/fgene.2019.00239,31001313,#1546,Sariya 2019,"",""
Parallel profiling of DNA methylation and hydroxymethylation highlights neuropathology-associated epigenetic variation in Alzheimer's disease.,Smith AR.; Smith RG.; Pishva E.; Hannon E.; Roubroeks JAY.; Burrage J.; Troakes C.; Al-Sarraj S.; Sloan C.; Mill J.; van den Hove DL.; Lunnon K.,"Alzheimer's disease is a progressive neurodegenerative disorder that is hypothesized to involve epigenetic dysfunction. Previous studies of DNA modifications in Alzheimer's disease have been unable to distinguish between DNA methylation and DNA hydroxymethylation. DNA hydroxymethylation has been shown to be enriched in the human brain, although its role in Alzheimer's disease has not yet been fully explored. Here, we utilize oxidative bisulfite conversion, in conjunction with the Illumina Infinium Human Methylation 450K microarray, to identify neuropathology-associated differential DNA methylation and DNA hydroxymethylation in the entorhinal cortex. We identified one experiment-wide significant differentially methylated position residing in the WNT5B gene. Next, we investigated pathology-associated regions consisting of multiple adjacent loci. We identified one significant differentially hydroxymethylated region consisting of four probes spanning 104 bases in the FBXL16 gene. We also identified two significant differentially methylated regions: one consisting of two probes in a 93 base-pair region in the ANK1 gene and the other consisting of six probes in a 99-base pair region in the ARID5B gene. We also highlighted three regions that show alterations in unmodified cytosine: two probes in a 39-base pair region of ALLC, two probes in a 69-base pair region in JAG2, and the same six probes in ARID5B that were differentially methylated. Finally, we replicated significant ANK1 disease-associated hypermethylation and hypohydroxymethylation patterns across eight CpG sites in an extended 118-base pair region in an independent cohort using oxidative-bisulfite pyrosequencing. Our study represents the first epigenome-wide association study of both DNA methylation and hydroxymethylation in Alzheimer's disease entorhinal cortex. We demonstrate that previous estimates of DNA hypermethylation in ANK1 in Alzheimer's disease were underestimates as it is confounded by hypohydroxymethylation.",2019,03,Clinical epigenetics,11,1,52,,10.1186/s13148-019-0636-y,30898171,#1544,Smith 2019,"",""
Linking Genetics of Brain Changes to Alzheimer's Disease: Sparse Whole Genome Association Scan of Regional MRI Volumes in the ADNI and AddNeuroMed Cohorts.,Khondoker M.; Newhouse S.; Westman E.; Muehlboeck JS.; Mecocci P.; Vellas B.; Tsolaki M.; Kłoszewska I.; Soininen H.; Lovestone S.; Dobson R.; Simmons A.;  .;  .,"Alzheimer's disease (AD) is a highly heritable disease, but until recently few replicated genetic markers have been identified. Markers identified so far are likely to account for only a tiny fraction of the heritability of AD and many more genetic risk alleles are thought to be undiscovered. Identifying genetic markers for AD using combined analysis of genetics and brain imaging data. Imaging quantitative trait loci (iQTLs) has recently emerged as an interesting research area for linking genetics of brain changes to AD. We consider a genome-wide association scan of 109 brain-wide regional imaging phenotypes to identify genetic susceptibility loci for AD from a combined set of 1,045 subjects from the Alzheimer's Disease Neuroimaging Initiative (ADNI) and the AddNeuroMed studies. We use one-SNP-at-a-time as well as multi-SNP Hyperlasso based iQTL methods for the analysis. We identified several novel markers associated with AD, namely HOMER2 (rs1256429; intronic, p = 8.7 × 10⁻¹⁰), EOMES (rs2724509; flanking), JAM2 (rs2829841; intronic), and WEE1 (rs10770042; coding). The SNP rs1256429 (HOMER2) was one of the top hits in Hyperlasso as well as in the single-SNP analysis showing an association with the volume of the right thalamus and AD, a brain region reported to be linked with AD in several studies. We believe that the markers identified in this study are novel additions to the existing list of genetic variants associated with AD which can be validated in future replicated studies.",2015,,Journal of Alzheimer's disease : JAD,45,3,851-64,,10.3233/JAD-142214,25649652,#1494,Khondoker 2015,"",""
Predicting Alzheimer's Disease Using Combined Imaging-Whole Genome SNP Data.,Kong D.; Giovanello KS.; Wang Y.; Lin W.; Lee E.; Fan Y.; Murali Doraiswamy P.; Zhu H.,"The growing public threat of Alzheimer's disease (AD) has raised the urgency to discover and validate prognostic biomarkers in order to predicting time to onset of AD. It is anticipated that both whole genome single nucleotide polymorphism (SNP) data and high dimensional whole brain imaging data offer predictive values to identify subjects at risk for progressing to AD. The aim of this paper is to test whether both whole genome SNP data and whole brain imaging data offer predictive values to identify subjects at risk for progressing to AD. In 343 subjects with mild cognitive impairment (MCI) enrolled in the Alzheimer's Disease Neuroimaging Initiative (ADNI-1), we extracted high dimensional MR imaging (volumetric data on 93 brain regions plus a surface fluid registration based hippocampal subregion and surface data), and whole genome data (504,095 SNPs from GWAS), as well as routine neurocognitive and clinical data at baseline. MCI patients were then followed over 48 months, with 150 participants progressing to AD. Combining information from whole brain MR imaging and whole genome data was substantially superior to the standard model for predicting time to onset of AD in a 48-month national study of subjects at risk. Our findings demonstrate the promise of combined imaging-whole genome prognostic markers in people with mild memory impairment.",2015,,Journal of Alzheimer's disease : JAD,46,3,695-702,,10.3233/JAD-150164,25869783,#1495,Kong 2015,"",""
The MTHFD1L gene rs11754661 marker is not associated with Alzheimer's disease in a sample of the Spanish population.,Ramírez-Lorca R.; Boada M.; Antúnez C.; López-Arrieta J.; Moreno-Rey C.; Hernández I.; Marín J.; Gayán J.; González-Pérez A.; Alegret M.; Tárraga L.; Real LM.; Ruiz A.,The MTHFD1L gene SNP variant rs11754661 was found to increase the risk of Alzheimer's disease in a recent Whole Genome Association Study. We have carried out an independent study of this genetic variant in 2467 individuals from Spain. We found no evidence of association between the MTHFD1L marker and susceptibility to Alzheimer's disease in our sample.,2011,,Journal of Alzheimer's disease : JAD,25,1,47-50,,10.3233/JAD-2011-101983,21383495,#1479,Ramírez-Lorca 2011,"",""
Discovery of sexual dimorphisms in metabolic and genetic biomarkers.,Mittelstrass K.; Ried JS.; Yu Z.; Krumsiek J.; Gieger C.; Prehn C.; Roemisch-Margl W.; Polonikov A.; Peters A.; Theis FJ.; Meitinger T.; Kronenberg F.; Weidinger S.; Wichmann HE.; Suhre K.; Wang-Sattler R.; Adamski J.; Illig T.,"Metabolomic profiling and the integration of whole-genome genetic association data has proven to be a powerful tool to comprehensively explore gene regulatory networks and to investigate the effects of genetic variation at the molecular level. Serum metabolite concentrations allow a direct readout of biological processes, and association of specific metabolomic signatures with complex diseases such as Alzheimer's disease and cardiovascular and metabolic disorders has been shown. There are well-known correlations between sex and the incidence, prevalence, age of onset, symptoms, and severity of a disease, as well as the reaction to drugs. However, most of the studies published so far did not consider the role of sexual dimorphism and did not analyse their data stratified by gender. This study investigated sex-specific differences of serum metabolite concentrations and their underlying genetic determination. For discovery and replication we used more than 3,300 independent individuals from KORA F3 and F4 with metabolite measurements of 131 metabolites, including amino acids, phosphatidylcholines, sphingomyelins, acylcarnitines, and C6-sugars. A linear regression approach revealed significant concentration differences between males and females for 102 out of 131 metabolites (p-values<3.8×10(-4); Bonferroni-corrected threshold). Sex-specific genome-wide association studies (GWAS) showed genome-wide significant differences in beta-estimates for SNPs in the CPS1 locus (carbamoyl-phosphate synthase 1, significance level: p<3.8×10(-10); Bonferroni-corrected threshold) for glycine. We showed that the metabolite profiles of males and females are significantly different and, furthermore, that specific genetic variants in metabolism-related genes depict sexual dimorphism. Our study provides new important insights into sex-specific differences of cell regulatory processes and underscores that studies should consider sex-specific effects in design and interpretation.",2011,Aug,PLoS genetics,7,8,e1002215,,10.1371/journal.pgen.1002215,21852955,#1480,Mittelstrass 2011,"",""
Genetic analysis of cortical thickness and fractional anisotropy of water diffusion in the brain.,Kochunov P.; Glahn DC.; Nichols TE.; Winkler AM.; Hong EL.; Holcomb HH.; Stein JL.; Thompson PM.; Curran JE.; Carless MA.; Olvera RL.; Johnson MP.; Cole SA.; Kochunov V.; Kent J.; Blangero J.,"The thickness of the brain's cortical gray matter (GM) and the fractional anisotropy (FA) of the cerebral white matter (WM) each follow an inverted U-shape trajectory with age. The two measures are positively correlated and may be modulated by common biological mechanisms. We employed four types of genetic analyses to localize individual genes acting pleiotropically upon these phenotypes. Whole-brain and regional GM thickness and FA values were measured from high-resolution anatomical and diffusion tensor MR images collected from 712, Mexican American participants (438 females, age = 47.9 ± 13.2 years) recruited from 73 (9.7 ± 9.3 individuals/family) large families. The significance of the correlation between two traits was estimated using a bivariate genetic correlation analysis. Localization of chromosomal regions that jointly influenced both traits was performed using whole-genome quantitative trait loci (QTL) analysis. Gene localization was performed using SNP genotyping on Illumina 1M chip and correlation with leukocyte-based gene-expression analyses. The gene-expressions were measured using the Illumina BeadChip. These data were available for 371 subjects. Significant genetic correlation was observed among GM thickness and FA values. Significant logarithm of odds (LOD ≥ 3.0) QTLs were localized within chromosome 15q22-23. More detailed localization reported no significant association (p < 5·10(-5)) for 1565 SNPs located within the QTLs. Post hoc analysis indicated that 40% of the potentially significant (p ≤ 10(-3)) SNPs were localized to the related orphan receptor alpha (RORA) and NARG2 genes. A potentially significant association was observed for the rs2456930 polymorphism reported as a significant GWAS finding in Alzheimer's disease neuroimaging initiative subjects. The expression levels for RORA and ADAM10 genes were significantly (p < 0.05) correlated with both FA and GM thickness. NARG2 expressions were significantly correlated with GM thickness (p < 0.05) but failed to show a significant correlation (p = 0.09) with FA. This study identified a novel, significant QTL at 15q22-23. SNP correlation with gene-expression analyses indicated that RORA, NARG2, and ADAM10 jointly influence GM thickness and WM-FA values.",2011,,Frontiers in neuroscience,5,,120,,10.3389/fnins.2011.00120,22028680,#1481,Kochunov 2011,"",""
Identification of gene pathways implicated in Alzheimer's disease using longitudinal imaging phenotypes with sparse regression.,Silver M.; Janousova E.; Hua X.; Thompson PM.; Montana G.;  .,"We present a new method for the detection of gene pathways associated with a multivariate quantitative trait, and use it to identify causal pathways associated with an imaging endophenotype characteristic of longitudinal structural change in the brains of patients with Alzheimer's disease (AD). Our method, known as pathways sparse reduced-rank regression (PsRRR), uses group lasso penalised regression to jointly model the effects of genome-wide single nucleotide polymorphisms (SNPs), grouped into functional pathways using prior knowledge of gene-gene interactions. Pathways are ranked in order of importance using a resampling strategy that exploits finite sample variability. Our application study uses whole genome scans and MR images from 99 probable AD patients and 164 healthy elderly controls in the Alzheimer's Disease Neuroimaging Initiative (ADNI) database. 66,182 SNPs are mapped to 185 gene pathways from the KEGG pathway database. Voxel-wise imaging signatures characteristic of AD are obtained by analysing 3D patterns of structural change at 6, 12 and 24 months relative to baseline. High-ranking, AD endophenotype-associated pathways in our study include those describing insulin signalling, vascular smooth muscle contraction and focal adhesion. All of these have been previously implicated in AD biology. In a secondary analysis, we investigate SNPs and genes that may be driving pathway selection. High ranking genes include a number previously linked in gene expression studies to β-amyloid plaque formation in the AD brain (PIK3R3,PIK3CG,PRKCAandPRKCB), and to AD related changes in hippocampal gene expression (ADCY2, ACTN1, ACACA, and GNAI1). Other high ranking previously validated AD endophenotype-related genes include CR1, TOMM40 and APOE.",2012,Nov,NeuroImage,63,3,1681-94,,10.1016/j.neuroimage.2012.08.002,22982105,#1482,Silver 2012,"",""
ABCA7 p.G215S as potential protective factor for Alzheimer's disease.,Sassi C.; Nalls MA.; Ridge PG.; Gibbs JR.; Ding J.; Lupton MK.; Troakes C.; Lunnon K.; Al-Sarraj S.; Brown KS.; Medway C.; Clement N.; Lord J.; Turton J.; Bras J.; Almeida MR.;  .; Holstege H.; Louwersheimer E.; van der Flier WM.; Scheltens P.; Van Swieten JC.; Santana I.; Oliveira C.; Morgan K.; Powell JF.; Kauwe JS.; Cruchaga C.; Goate AM.; Singleton AB.; Guerreiro R.; Hardy J.,"Genome-wide association studies (GWASs) have been effective approaches to dissect common genetic variability underlying complex diseases in a systematic and unbiased way. Recently, GWASs have led to the discovery of over 20 susceptibility loci for Alzheimer's disease (AD). Despite the evidence showing the contribution of these loci to AD pathogenesis, their genetic architecture has not been extensively investigated, leaving the possibility that low frequency and rare coding variants may also occur and contribute to the risk of disease. We have used exome and genome sequencing data to analyze the single independent and joint effect of rare and low-frequency protein coding variants in 9 AD GWAS loci with the strongest effect sizes after APOE (BIN1, CLU, CR1, PICALM, MS4A6A, ABCA7, EPHA1, CD33, and CD2AP) in a cohort of 332 sporadic AD cases and 676 elderly controls of British and North-American ancestry. We identified coding variability in ABCA7 as contributing to AD risk. This locus harbors a low-frequency coding variant (p.G215S, rs72973581, minor allele frequency = 4.3%) conferring a modest but statistically significant protection against AD (p-value = 0.024, odds ratio = 0.57, 95% confidence interval = 0.41-0.80). Notably, our results are not driven by an enrichment of loss of function variants in ABCA7, recently reported as main pathogenic factor underlying AD risk at this locus. In summary, our study confirms the role of ABCA7 in AD and provides new insights that should address functional studies.",2016,10,Neurobiology of aging,46,,235.e1-9,,10.1016/j.neurobiolaging.2016.04.004,27289440,#1508,Sassi 2016,"",""
Whole exome sequence-based association analyses of plasma amyloid-β in African and European Americans; the Atherosclerosis Risk in Communities-Neurocognitive Study.,Simino J.; Wang Z.; Bressler J.; Chouraki V.; Yang Q.; Younkin SG.; Seshadri S.; Fornage M.; Boerwinkle E.; Mosley TH.,"We performed single-variant and gene-based association analyses of plasma amyloid-β (aβ) concentrations using whole exome sequence from 1,414 African and European Americans. Our goal was to identify genes that influence plasma aβ42 concentrations and aβ42:aβ40 ratios in late middle age (mean = 59 years), old age (mean = 77 years), or change over time (mean = 18 years). Plasma aβ measures were linearly regressed onto age, gender, APOE ε4 carrier status, and time elapsed between visits (fold-changes only) separately by race. Following inverse normal transformation of the residuals, seqMeta was used to conduct race-specific single-variant and gene-based association tests while adjusting for population structure. Linear regression models were fit on autosomal variants with minor allele frequencies (MAF)≥1%. T5 burden and Sequence Kernel Association (SKAT) gene-based tests assessed functional variants with MAF≤5%. Cross-race fixed effects meta-analyses were Bonferroni-corrected for the number of variants or genes tested. Seven genes were associated with aβ in late middle age or change over time; no associations were identified in old age. Single variants in KLKB1 (rs3733402; p = 4.33x10-10) and F12 (rs1801020; p = 3.89x10-8) were significantly associated with midlife aβ42 levels through cross-race meta-analysis; the KLKB1 variant replicated internally using 1,014 additional participants with exome chip. ITPRIP, PLIN2, and TSPAN18 were associated with the midlife aβ42:aβ40 ratio via the T5 test; TSPAN18 was significant via the cross-race meta-analysis, whereas ITPRIP and PLIN2 were European American-specific. NCOA1 and NT5C3B were associated with the midlife aβ42:aβ40 ratio and the fold-change in aβ42, respectively, via SKAT in African Americans. No associations replicated externally (N = 725). We discovered age-dependent genetic effects, established associations between vascular-related genes (KLKB1, F12, PLIN2) and midlife plasma aβ levels, and identified a plausible Alzheimer's Disease candidate gene (ITPRIP) influencing cell death. Plasma aβ concentrations may have dynamic biological determinants across the lifespan; plasma aβ study designs or analyses must consider age.",2017,,PloS one,12,7,e0180046,,10.1371/journal.pone.0180046,28704393,#1518,Simino 2017,"",""
