Title,Authors,Abstract,Published Year,Published Month,Journal,Volume,Issue,Pages,Accession Number,DOI,Ref,Covidence #,Study,Notes,Tags
Whole genome association analysis shows that ACE is a risk factor for Alzheimer's disease and fails to replicate most candidates from Meta-analysis.,Webster J.; Reiman EM.; Zismann VL.; Joshipura KD.; Pearson JV.; Hu-Lince D.; Huentelman MJ.; Craig DW.; Coon KD.; Beach T.; Rohrer KC.; Zhao AS.; Leung D.; Bryden L.; Marlowe L.; Kaleem M.; Mastroeni D.; Grover A.; Rogers J.; Heun R.; Jessen F.; Kölsch H.; Heward CB.; Ravid R.; Hutton ML.; Melquist S.; Petersen RC.; Caselli RJ.; Papassotiropoulos A.; Stephan DA.; Hardy J.; Myers A.,"For late onset Alzheimer's disease (LOAD), the only confirmed, genetic association is with the apolipoprotein E (APOE) locus on chromosome 19. Meta-analysis is often employed to sort the true associations from the false positives. LOAD research has the advantage of a continuously updated meta-analysis of candidate gene association studies in the web-based AlzGene database. The top 30 AlzGene loci on May 1(st), 2007 were investigated in our whole genome association data set consisting of 1411 LOAD cases and neuropathoiogicaiiy verified controls genotyped at 312,316 SNPs using the Affymetrix 500K Mapping Platform. Of the 30 ""top AlzGenes"", 32 SNPs in 24 genes had odds ratios (OR) whose 95% confidence intervals that did not include 1. Of these 32 SNPs, six were part of the Affymetrix 500K Mapping panel and another ten had proxies on the Affymetrix array that had >80% power to detect an association with α=0.001. Two of these 16 SNPs showed significant association with LOAD in our sample series. One was rs4420638 at the APOE locus (uncorrected p-value=4.58E-37) and the other was rs4293, located in the angiotensin converting enzyme (ACE) locus (uncorrected p-value=0.014). Since this result was nominally significant, but did not survive multiple testing correction for 16 independent tests, this association at rs4293 was verified in a geographically distinct German cohort (p-value=0.03). We present the results of our ACE replication aiongwith a discussion of the statistical limitations of multiple test corrections in whole genome studies.",2010,,International journal of molecular epidemiology and genetics,1,1,19-30,,,21537449,#1474,Webster 2010,"",""
Genetic modifiers of risk and age at onset in GBA associated Parkinson's disease and Lewy body dementia.,Blauwendraat C.; Reed X.; Krohn L.; Heilbron K.; Bandres-Ciga S.; Tan M.; Gibbs JR.; Hernandez DG.; Kumaran R.; Langston R.; Bonet-Ponce L.; Alcalay RN.; Hassin-Baer S.; Greenbaum L.; Iwaki H.; Leonard HL.; Grenn FP.; Ruskey JA.; Sabir M.; Ahmed S.; Makarious MB.; Pihlstrøm L.; Toft M.; van Hilten JJ.; Marinus J.; Schulte C.; Brockmann K.; Sharma M.; Siitonen A.; Majamaa K.; Eerola-Rautio J.; Tienari PJ.;  .; Pantelyat A.; Hillis AE.; Dawson TM.; Rosenthal LS.; Albert MS.; Resnick SM.; Ferrucci L.; Morris CM.; Pletnikova O.; Troncoso J.; Grosset D.; Lesage S.; Corvol JC.; Brice A.; Noyce AJ.; Masliah E.; Wood N.; Hardy J.; Shulman LM.; Jankovic J.; Shulman JM.; Heutink P.; Gasser T.; Cannon P.; Scholz SW.; Morris H.; Cookson MR.; Nalls MA.; Gan-Or Z.; Singleton AB.,"Parkinson's disease is a genetically complex disorder. Multiple genes have been shown to contribute to the risk of Parkinson's disease, and currently 90 independent risk variants have been identified by genome-wide association studies. Thus far, a number of genes (including SNCA, LRRK2, and GBA) have been shown to contain variability across a spectrum of frequency and effect, from rare, highly penetrant variants to common risk alleles with small effect sizes. Variants in GBA, encoding the enzyme glucocerebrosidase, are associated with Lewy body diseases such as Parkinson's disease and Lewy body dementia. These variants, which reduce or abolish enzymatic activity, confer a spectrum of disease risk, from 1.4- to >10-fold. An outstanding question in the field is what other genetic factors that influence GBA-associated risk for disease, and whether these overlap with known Parkinson's disease risk variants. Using multiple, large case-control datasets, totalling 217 165 individuals (22 757 Parkinson's disease cases, 13 431 Parkinson's disease proxy cases, 622 Lewy body dementia cases and 180 355 controls), we identified 1691 Parkinson's disease cases, 81 Lewy body dementia cases, 711 proxy cases and 7624 controls with a GBA variant (p.E326K, p.T369M or p.N370S). We performed a genome-wide association study and analysed the most recent Parkinson's disease-associated genetic risk score to detect genetic influences on GBA risk and age at onset. We attempted to replicate our findings in two independent datasets, including the personal genetics company 23andMe, Inc. and whole-genome sequencing data. Our analysis showed that the overall Parkinson's disease genetic risk score modifies risk for disease and decreases age at onset in carriers of GBA variants. Notably, this effect was consistent across all tested GBA risk variants. Dissecting this signal demonstrated that variants in close proximity to SNCA and CTSB (encoding cathepsin B) are the most significant contributors. Risk variants in the CTSB locus were identified to decrease mRNA expression of CTSB. Additional analyses suggest a possible genetic interaction between GBA and CTSB and GBA p.N370S induced pluripotent cell-derived neurons were shown to have decreased cathepsin B expression compared to controls. These data provide a genetic basis for modification of GBA-associated Parkinson's disease risk and age at onset, although the total contribution of common genetics variants is not large. We further demonstrate that common variability at genes implicated in lysosomal function exerts the largest effect on GBA associated risk for disease. Further, these results have implications for selection of GBA carriers for therapeutic interventions.",2020,01,Brain : a journal of neurology,143,1,234-248,,10.1093/brain/awz350,31755958,#1552,Blauwendraat 2020,"",""
A precision medicine framework using artificial intelligence for the identification and confirmation of genomic biomarkers of response to an Alzheimer's disease therapy: Analysis of the blarcamesine (ANAVEX2-73) Phase 2a clinical study.,Hampel H.; Williams C.; Etcheto A.; Goodsaid F.; Parmentier F.; Sallantin J.; Kaufmann WE.; Missling CU.; Afshar M.,"The search for drugs to treat Alzheimer's disease (AD) has failed to yield effective therapies. Here we report the first genome-wide search for biomarkers associated with therapeutic response in AD. Blarcamesine (ANAVEX2-73), a selective sigma-1 receptor (SIGMAR1) agonist, was studied in a 57-week Phase 2a trial (NCT02244541). The study was extended for a further 208 weeks (NCT02756858) after meeting its primary safety endpoint. Safety, clinical features, pharmacokinetic, and efficacy, measured by changes in the Mini-Mental State Examination (MMSE) and the Alzheimer's Disease Cooperative Study-Activities of Daily Living scale (ADCS-ADL), were recorded. Whole exome and transcriptome sequences were obtained for 21 patients. The relationship between all available patient data and efficacy outcome measures was analyzed with unsupervised formal concept analysis (FCA), integrated in the Knowledge Extraction and Management (KEM) environment. Biomarkers with a significant impact on clinical outcomes were identified at week 57: mean plasma concentration of blarcamesine (slope MMSE:P < .041), genomic variants SIGMAR1 p.Gln2Pro (ΔMMSE:P < .039; ΔADCS-ADL:P < .063) and COMT p.Leu146fs (ΔMMSE:P < .039; ΔADCS-ADL:P < .063), and baseline MMSE score (slope MMSE:P < .015). Their combined impact on drug response was confirmed at week 148 with linear mixed effect models. Confirmatory Phase 2b/3 clinical studies of these patient selection markers are ongoing. This FCA/KEM analysis is a template for the identification of patient selection markers in early therapeutic development for neurologic disorders.",2020,,"Alzheimer's & dementia (New York, N. Y.)",6,1,e12013,,10.1002/trc2.12013,32318621,#1554,Hampel 2020,"",""
Alzheimer's disease genetic risk and sleep phenotypes: association with more slow-waves and daytime sleepiness.,Muto V.; Koshmanova E.; Ghaemmaghami P.; Jaspar M.; Meyer C.; Elansary M.; Van Egroo M.; Chylinski D.; Berthomier C.; Brandewinder M.; Mouraux C.; Schmidt C.; Hammad G.; Coppieters W.; Ahariz N.; Degueldre C.; Luxen A.; Salmon E.; Phillips C.; Archer SN.; Yengo L.; Byrne E.; Collette F.; Georges M.; Dijk DJ.; Maquet P.; Visscher PM.; Vandewalle G.,"Sleep disturbances and genetic variants have been identified as risk factors for Alzheimer's disease. Our goal was to assess whether genome-wide polygenic risk scores (PRS) for AD associate with sleep phenotypes in young adults, decades before typical AD symptom onset. We computed whole-genome Polygenic Risk Scores (PRS) for AD and extensively phenotyped sleep under different sleep conditions, including baseline sleep, recovery sleep following sleep deprivation and extended sleep opportunity, in a carefully selected homogenous sample of healthy 363 young men (22.1 y ± 2.7) devoid of sleep and cognitive disorders. AD PRS was associated with more slow wave energy, i.e. the cumulated power in the 0.5-4 Hz EEG band, a marker of sleep need, during habitual sleep and following sleep loss, and potentially with large slow wave sleep rebound following sleep deprivation. Furthermore, higher AD PRS was correlated with higher habitual daytime sleepiness. These results imply that sleep features may be associated with AD liability in young adults, when current AD biomarkers are typically negative, and the notion that quantifying sleep alterations may be useful in assessing the risk for developing AD.",2020,Jul,Sleep,,,,,10.1093/sleep/zsaa137,32671396,#1560,Muto 2020,"",""
Allele-specific DNA methylation is increased in cancers and its dense mapping in normal plus neoplastic cells increases the yield of disease-associated regulatory SNPs.,Do C.; Dumont ELP.; Salas M.; Castano A.; Mujahed H.; Maldonado L.; Singh A.; DaSilva-Arnold SC.; Bhagat G.; Lehman S.; Christiano AM.; Madhavan S.; Nagy PL.; Green PHR.; Feinman R.; Trimble C.; Illsley NP.; Marder K.; Honig L.; Monk C.; Goy A.; Chow K.; Goldlust S.; Kaptain G.; Siegel D.; Tycko B.,"Mapping of allele-specific DNA methylation (ASM) can be a post-GWAS strategy for localizing regulatory sequence polymorphisms (rSNPs). The advantages of this approach, and the mechanisms underlying ASM in normal and neoplastic cells, remain to be clarified. We perform whole genome methyl-seq on diverse normal cells and tissues and three cancer types. After excluding imprinting, the data pinpoint 15,112 high-confidence ASM differentially methylated regions, of which 1838 contain SNPs in strong linkage disequilibrium or coinciding with GWAS peaks. ASM frequencies are increased in cancers versus matched normal tissues, due to widespread allele-specific hypomethylation and focal allele-specific hypermethylation in poised chromatin. Cancer cells show increased allele switching at ASM loci, but disruptive SNPs in specific classes of CTCF and transcription factor binding motifs are similarly correlated with ASM in cancer and non-cancer. Rare somatic mutations affecting these same motif classes track with de novo ASM. Allele-specific transcription factor binding from ChIP-seq is enriched among ASM loci, but most ASM differentially methylated regions lack such annotations, and some are found in otherwise uninformative ""chromatin deserts."" ASM is increased in cancers but occurs by a shared mechanism involving disruptive SNPs in CTCF and transcription factor binding sites in both normal and neoplastic cells. Dense ASM mapping in normal plus cancer samples reveals candidate rSNPs that are difficult to find by other approaches. Together with GWAS data, these rSNPs can nominate specific transcriptional pathways in susceptibility to autoimmune, cardiometabolic, neuropsychiatric, and neoplastic diseases.",2020,Jun,Genome biology,21,1,153,,10.1186/s13059-020-02059-3,32594908,#1559,Do 2020,"",""
Whole genome sequence analyses of brain imaging measures in the Framingham Study.,Sarnowski C.; Satizabal CL.; DeCarli C.; Pitsillides AN.; Cupples LA.; Vasan RS.; Wilson JG.; Bis JC.; Fornage M.; Beiser AS.; DeStefano AL.; Dupuis J.; Seshadri S.;  .;  .,"We sought to identify rare variants influencing brain imaging phenotypes in the Framingham Heart Study by performing whole genome sequence association analyses within the Trans-Omics for Precision Medicine Program. We performed association analyses of cerebral and hippocampal volumes and white matter hyperintensity (WMH) in up to 2,180 individuals by testing the association of rank-normalized residuals from mixed-effect linear regression models adjusted for sex, age, and total intracranial volume with individual variants while accounting for familial relatedness. We conducted gene-based tests for rare variants using (1) a sliding-window approach, (2) a selection of functional exonic variants, or (3) all variants. We detected new loci in 1p21 for cerebral volume (minor allele frequency [MAF] 0.005, p = 10-8) and in 16q23 for hippocampal volume (MAF 0.05, p = 2.7 × 10-8). Previously identified associations in 12q24 for hippocampal volume (rs7294919, p = 4.4 × 10-4) and in 17q25 for WMH (rs7214628, p = 2.0 × 10-3) were confirmed. Gene-based tests detected associations (p ≤ 2.3 × 10-6) in new loci for cerebral (5q13, 8p12, 9q31, 13q12-q13, 15q24, 17q12, 19q13) and hippocampal volumes (2p12) and WMH (3q13, 4p15) including Alzheimer disease- (UNC5D) and Parkinson disease-associated genes (GBA). Pathway analyses evidenced enrichment of associated genes in immunity, inflammation, and Alzheimer disease and Parkinson disease pathways. Whole genome sequence-wide search reveals intriguing new loci associated with brain measures. Replication of novel loci is needed to confirm these findings.",2018,01,Neurology,90,3,e188-e196,,10.1212/WNL.0000000000004820,29282330,#1524,Sarnowski 2018,"",""
Revealing Alzheimer's disease genes spectrum in the whole-genome by machine learning.,Huang X.; Liu H.; Li X.; Guan L.; Li J.; Tellier LCAM.; Yang H.; Wang J.; Zhang J.,"Alzheimer's disease (AD) is an important, progressive neurodegenerative disease, with a complex genetic architecture. A key goal of biomedical research is to seek out disease risk genes, and to elucidate the function of these risk genes in the development of disease. For this purpose, expanding the AD-associated gene set is necessary. In past research, the prediction methods for AD related genes has been limited in their exploration of the target genome regions. We here present a genome-wide method for AD candidate genes predictions. We present a machine learning approach (SVM), based upon integrating gene expression data with human brain-specific gene network data, to discover the full spectrum of AD genes across the whole genome. We classified AD candidate genes with an accuracy and the area under the receiver operating characteristic (ROC) curve of 84.56% and 94%. Our approach provides a supplement for the spectrum of AD-associated genes extracted from more than 20,000 genes in a genome wide scale. In this study, we have elucidated the whole-genome spectrum of AD, using a machine learning approach. Through this method, we expect for the candidate gene catalogue to provide a more comprehensive annotation of AD for researchers.",2018,Jan,BMC neurology,18,1,5,,10.1186/s12883-017-1010-3,29320986,#1525,Huang 2018,"",""
Sleep-wake disorders in Alzheimer's disease: further genetic analyses in relation to objective sleep measures.,Yesavage JA.; Noda A.; Heath A.; McNerney MW.; Domingue BW.; Hernandez Y.; Benson G.; Hallmayer J.; O'Hara R.; Williams LM.; Goldstein-Piekarski AN.; Zeitzer JM.; Fairchild JK.,"This paper presents updated analyses on the genetic associations of sleep disruption in individuals with Alzheimer's disease (AD). We published previously a study of the association between single nucleotide polymorphisms (SNPs) found in eight genes related to circadian rhythms and objective measures of sleep-wake disturbances in 124 individuals with AD. Here, we present new relevant analyses using polygenic risk scores (PRS) and variable number tandem repeats (VNTRs) enumerations. PRS were calculated using the genetic data from the original participants and relevant genome wide association studies (GWAS). VNTRs for the same circadian rhythm genes studied with SNPs were obtained from a separate cohort of participants using whole genome sequencing (WGS). Objectively (wrist actigraphy) determined wake after sleep onset (WASO) was used as a measure of sleep disruption. None of the PRS were associated with sleep disturbance. Computer analyses using VNTRseek software generated a total of 30 VNTRs for the circadian-related genes but none appear relevant to our objective sleep measure. In addition, of 71 neurotransmitter function-related genes, 29 genes had VNTRs that differed from the reference VNTR, but it was not clear if any of these might affect circadian function in AD patients. Although we have not found in either the current analyses or in our previous published analyses of SNPs any direct linkages between identified genetic factors and WASO, research in this area remains in its infancy.",2020,Jul,International psychogeriatrics,32,7,807-813,,10.1017/S1041610219001777,31739820,#1550,Yesavage 2020,"",""
Genome-wide analyses as part of the international FTLD-TDP whole-genome sequencing consortium reveals novel disease risk factors and increases support for immune dysfunction in FTLD.,Pottier C.; Ren Y.; Perkerson RB.; Baker M.; Jenkins GD.; van Blitterswijk M.; DeJesus-Hernandez M.; van Rooij JGJ.; Murray ME.; Christopher E.; McDonnell SK.; Fogarty Z.; Batzler A.; Tian S.; Vicente CT.; Matchett B.; Karydas AM.; Hsiung GR.; Seelaar H.; Mol MO.; Finger EC.; Graff C.; Öijerstedt L.; Neumann M.; Heutink P.; Synofzik M.; Wilke C.; Prudlo J.; Rizzu P.; Simon-Sanchez J.; Edbauer D.; Roeber S.; Diehl-Schmid J.; Evers BM.; King A.; Mesulam MM.; Weintraub S.; Geula C.; Bieniek KF.; Petrucelli L.; Ahern GL.; Reiman EM.; Woodruff BK.; Caselli RJ.; Huey ED.; Farlow MR.; Grafman J.; Mead S.; Grinberg LT.; Spina S.; Grossman M.; Irwin DJ.; Lee EB.; Suh E.; Snowden J.; Mann D.; Ertekin-Taner N.; Uitti RJ.; Wszolek ZK.; Josephs KA.; Parisi JE.; Knopman DS.; Petersen RC.; Hodges JR.; Piguet O.; Geier EG.; Yokoyama JS.; Rissman RA.; Rogaeva E.; Keith J.; Zinman L.; Tartaglia MC.; Cairns NJ.; Cruchaga C.; Ghetti B.; Kofler J.; Lopez OL.; Beach TG.; Arzberger T.; Herms J.; Honig LS.; Vonsattel JP.; Halliday GM.; Kwok JB.; White CL.; Gearing M.; Glass J.; Rollinson S.; Pickering-Brown S.; Rohrer JD.; Trojanowski JQ.; Van Deerlin V.; Bigio EH.; Troakes C.; Al-Sarraj S.; Asmann Y.; Miller BL.; Graff-Radford NR.; Boeve BF.; Seeley WW.; Mackenzie IRA.; van Swieten JC.; Dickson DW.; Biernacka JM.; Rademakers R.,"Frontotemporal lobar degeneration with neuronal inclusions of the TAR DNA-binding protein 43 (FTLD-TDP) represents the most common pathological subtype of FTLD. We established the international FTLD-TDP whole-genome sequencing consortium to thoroughly characterize the known genetic causes of FTLD-TDP and identify novel genetic risk factors. Through the study of 1131 unrelated Caucasian patients, we estimated that C9orf72 repeat expansions and GRN loss-of-function mutations account for 25.5% and 13.9% of FTLD-TDP patients, respectively. Mutations in TBK1 (1.5%) and other known FTLD genes (1.4%) were rare, and the disease in 57.7% of FTLD-TDP patients was unexplained by the known FTLD genes. To unravel the contribution of common genetic factors to the FTLD-TDP etiology in these patients, we conducted a two-stage association study comprising the analysis of whole-genome sequencing data from 517 FTLD-TDP patients and 838 controls, followed by targeted genotyping of the most associated genomic loci in 119 additional FTLD-TDP patients and 1653 controls. We identified three genome-wide significant FTLD-TDP risk loci: one new locus at chromosome 7q36 within the DPP6 gene led by rs118113626 (p value = 4.82e - 08, OR = 2.12), and two known loci: UNC13A, led by rs1297319 (p value = 1.27e - 08, OR = 1.50) and HLA-DQA2 led by rs17219281 (p value = 3.22e - 08, OR = 1.98). While HLA represents a locus previously implicated in clinical FTLD and related neurodegenerative disorders, the association signal in our study is independent from previously reported associations. Through inspection of our whole-genome sequence data for genes with an excess of rare loss-of-function variants in FTLD-TDP patients (n ≥ 3) as compared to controls (n = 0), we further discovered a possible role for genes functioning within the TBK1-related immune pathway (e.g., DHX58, TRIM21, IRF7) in the genetic etiology of FTLD-TDP. Together, our study based on the largest cohort of unrelated FTLD-TDP patients assembled to date provides a comprehensive view of the genetic landscape of FTLD-TDP, nominates novel FTLD-TDP risk loci, and strongly implicates the immune pathway in FTLD-TDP pathogenesis.",2019,06,Acta neuropathologica,137,6,879-899,,10.1007/s00401-019-01962-9,30739198,#1542,Pottier 2019,"",""
Microglia - mediated immunity partly contributes to the genetic association between Alzheimer's disease and hippocampal volume.,Lancaster TM.; Hill MJ.; Sims R.; Williams J.,"Genome-wide association studies (GWAS) suggest that Alzheimer's disease (AD) is partly explained by a burden of risk alleles (single nucleotide polymorphisms; SNPs) with relatively small effects. However, the mechanisms by which these loci cumulatively confer susceptibility remain largely unknown. Accumulating evidence suggests an association between increased AD risk allele burden (measured via a polygenic risk profile score; AD-RPS) with reduced hippocampal volume (HV) across a number of independent cohorts. These lines of research suggest that the reduced HV may be a causal mechanism of risk in the development of late-onset Alzheimer's disease (AD). However, as RPS assesses broad, cumulative genetic risk, little is known about the biological processes which may explain this observation. Here, we leverage GWAS data from i) 17,008 late onset AD cases & 37,154 controls and ii) hippocampal volume (N = 12,147; N = 9707) to explore putative pathways that may explain this association. We first demonstrate an association between whole genome AD-RPS and HV (PT < 0.5, Z = -2.07, P = 0.038), confirming previous associations. Second, we restrict our analysis to SNPs within AD genes within a microglia mediated immunity network (NGENES = 56). A microglia AD-RPS was further associated with HV (PT < 0.01; Z = -2.152, P = 0.031). Last, using a competitive, permutation based approach, we show that the common variation within this candidate gene-set is associated with HV, controlling for SNP set-size (P = 0.024). Together, the observations suggest that the relationship between AD and HV is partially explained by genes within an AD-linked microglia mediated immunity network.",2019,07,"Brain, behavior, and immunity",79,,267-273,,10.1016/j.bbi.2019.02.011,30776473,#1543,Lancaster 2019,"",""
African American exome sequencing identifies potential risk variants at Alzheimer disease loci.,N'Songo A.; Carrasquillo MM.; Wang X.; Burgess JD.; Nguyen T.; Asmann YW.; Serie DJ.; Younkin SG.; Allen M.; Pedraza O.; Duara R.; Greig Custo MT.; Graff-Radford NR.; Ertekin-Taner N.,"In African Americans, we sought to systematically identify coding Alzheimer disease (AD) risk variants at the previously reported AD genome-wide association study (GWAS) loci genes. We identified coding variants within genes at the 20 published AD GWAS loci by whole-exome sequencing of 238 African American participants, validated these in 300 additional participants, and tested their association with AD risk in the combined cohort of 538 and with memory endophenotypes in 319 participants. Two ABCA7 missense variants (rs3764647 and rs3752239) demonstrated significant association with AD risk. Variants in MS4A6A, PTK2B, and ZCWPW1 showed significant gene-based association. In addition, coding variants in ZCWPW1 (rs6465770) and NME8 (rs10250905 and rs62001869) showed association with memory endophenotypes. Our findings support a role for ABCA7 missense variants in conferring AD risk in African Americans, highlight allelic heterogeneity at this locus, suggest the presence of AD-risk variants in MS4A6A, PTK2B, and ZCWPW1, nominate additional variants that may modulate cognition, and importantly provide a thorough screen of coding variants at AD GWAS loci that can guide future studies in this population.",2017,Apr,Neurology. Genetics,3,2,e141,,10.1212/NXG.0000000000000141,28480329,#1516,N'Songo 2017,"",""
